{
  "version_contrato": 1,
  "idempotencia": "16161616-1616-4161-8161-161616161616",
  "sucursal": {
    "id": "11111111-1111-4111-8111-111111111111",
    "clave": "LAB01",
    "nombre": "Sucursal laboratorio uno"
  },
  "periodo": "2026-08-01",
  "totales": {
    "periodo": "2026-08-01",
    "cortes": 31,
    "ventas": "125000.50",
    "resultado_caja": "124800.50",
    "ingresos": "500.00",
    "gastos": "700.00",
    "terminales": "34000.00",
    "canales": {
      "comedor": "80000.50",
      "llevar": "45000.00"
    },
    "apps": {},
    "sucursales": {}
  }
}
