{
  "version_contrato": 1,
  "idempotencia": "16161616-1616-4161-8161-161616161617",
  "sucursal": {
    "id": "11111111-1111-4111-8111-111111111111",
    "clave": "LAB01",
    "nombre": "Sucursal laboratorio uno",
    "campo_compatibilidad_actual": "aceptado_por_a931c46"
  },
  "periodo": "2026-07-01",
  "totales": {
    "periodo": "2026-07-01",
    "cortes": 31,
    "ventas": 125000.5,
    "resultado_caja": 124800.5,
    "ingresos": 500,
    "gastos": "700.0",
    "terminales": 34000,
    "canales": {"comedor": 80000.5},
    "apps": {},
    "sucursales": {},
    "campo_compatibilidad_actual": true
  }
}